<?xml version="1.0" encoding="UTF-8"?>
<!DOCTYPE fieldchecking SYSTEM "fieldchecking.dtd">
<fieldchecking>
	<group name="setPassword">
	<!--  update by liang_ly for CR204 2015-4-10 -->
		<field name="oldPassword" label="Old_Password" required="yes">
			<format type="String" />
		</field>
	
	    <field name="newPassword" label="New_Password" required="yes">
			<format type="String" />
			<!--  update by liang_ly for CR204 2015-4-10	
			<reject prompt="Password_Info1">[newPassword]!='' &amp;&amp; [newPassword]==[oldPassword]</reject>
			-->
			<reject prompt="Password_Range">([newPassword].length &lt; pin_min) || ([newPassword].length &gt; pin_max)</reject>
			<reject prompt="Password_Upper_Lower">(parseInt([checkUpperNum]) &lt; pin_upper) || (parseInt([checkLowerNum]) &lt; pin_lower)</reject>
			
			<!-- add by long_zg 2015-06-24 for CR210 New policy to BOB/BOL password -->
			<reject prompt="Char_Num_Only">checkCharNum([newPassword])</reject>
			<reject prompt="Password_UserId_Same">([newPassword].toLowerCase()  == [userId].toLowerCase())</reject>
			<reject prompt="Password_UserId_Reverse_Same">([newPassword].toLowerCase()  == ([userId].split('').reverse().join('')).toLowerCase())</reject>
			<reject prompt="Password_Include_IdNo">((''!=[idNo]) &amp;&amp; (-1 != ([newPassword].toLowerCase() .indexOf((eliminate([idNo])).toLowerCase()))))</reject>
			
		</field>
		<field name="confirmPassword" label="Confirm_Password" required="yes">
			<format type="String" />
			<depend prompt="Password_Info">[confirmPassword]!='' &amp;&amp; [newPassword]==[confirmPassword]</depend>
		</field>
	</group>
	<group name="setSecurityCode">
		<field name="oldSecurityCode" label="Old_S_Code" required="yes">
			<format type="String" />
		</field>
	    <field name="newSecurityCode" label="New_S_Code" required="yes">
			<format type="String" />
			<reject prompt="Security_Code_Info1">[newSecurityCode]!='' &amp;&amp; [newSecurityCode]==[oldSecurityCode]</reject>
			<reject prompt="SecurityCode_Range">([newSecurityCode].length &lt; pin2_min) || ([newSecurityCode].length &gt; pin2_max)</reject>
			<reject prompt="SecurityCode_Upper_Lower">(parseInt([checkUpperNum]) &lt; pin2_upper) || (parseInt([checkLowerNum]) &lt; pin2_lower)</reject>
			
			<!-- add by long_zg 2015-06-24 for CR210 New policy to BOB/BOL password -->
			<reject prompt="Char_Num_Only">checkCharNum([newSecurityCode])</reject>
			<reject prompt="Password_UserId_Same">([newSecurityCode].toLowerCase()  == [userId].toLowerCase())</reject>
			<reject prompt="Password_UserId_Reverse_Same">([newSecurityCode].toLowerCase()  == ([userId].split('').reverse().join('')).toLowerCase())</reject>
			<reject prompt="Password_Include_IdNo">((''!=[idNo]) &amp;&amp; (-1 != ([newSecurityCode].toLowerCase() .indexOf((eliminate([idNo])).toLowerCase()))))</reject>
			
		</field>
		<field name="confirmSecurityCode" label="New_S_Code_Confirm" required="yes">
			<format type="String" />
			<depend prompt="Security_Code_Info">[confirmSecurityCode]!='' &amp;&amp; [newSecurityCode]==[confirmSecurityCode]</depend>
		</field>
	</group>

	<group name="bank_setPassword">
		<field name="oldPassword" label="Old_Password" required="yes">
			<format type="String" minlen="6" />
		</field>
	        <field name="newPassword" label="New_Password" required="yes">
			<format type="String" minlen="6" />
			<reject prompt="Password_Info1">[newPassword]!='' &amp;&amp; [newPassword]==[oldPassword]</reject>
		</field>
		<field name="confirmPassword" label="Confirm_Password" required="yes">
			<format type="String" />
			<depend prompt="Password_Info">[confirmPassword]!='' &amp;&amp; [newPassword]==[confirmPassword]</depend>
		</field>
	</group>
</fieldchecking>
