<?xml version="1.0" encoding="UTF-8"?>
<!DOCTYPE fieldchecking SYSTEM "fieldchecking.dtd">
<fieldchecking>
	<group name="schedule_macau">
	   <field name="scheduleName" label="Schedule_Name" required="yes">
			<format type="String" />
		</field>
		<field name="dayType" label="Frequence" required="yes">
			<reject prompt="Weekly_Justify">
				[dayType]=="2" &amp;&amp; [frequenceWeekDays]==null
			</reject>
			<reject prompt="Monthly_Justify">
				[dayType]=="3" &amp;&amp; [month_type]==null
			</reject>
			<reject prompt="monthly_designed_day_format_error">
				[dayType]=="3" &amp;&amp; [month_type]==0 &amp;&amp;
				([designed_day]&lt;1 || [designed_day]&gt;31)
			</reject>
			<reject prompt="Days_per_month_Justify">
				[dayType]=="4" &amp;&amp; [days_per_month]==""
			</reject>
		</field>
		<field name="fromAccount" label="Account Number" required="no">
			<format type="numonly" />
			<reject prompt="Required">document.getElementById("fromAccount").selectedIndex == 0</reject>
		</field>
		<field name="fromCurrency" label="From Currency" required="no">
			<format type="numonly" />
			<reject prompt="Required">document.getElementById("fromCurrency").selectedIndex == 0</reject>
			<reject prompt="fromCurrency_Justify_1">document.getElementById("fromCurrency").value=="CNY"</reject>
		</field>
		<field name="toCurrency" label="To Currency" required="no">
			<format type="numonly" />
			<reject prompt="Required">document.getElementById("toCurrency").selectedIndex == 0</reject>
			<!-- add by lzg 20190613 -->
			<reject prompt="toCurrency_Justify">document.getElementById("toCurrency").value != "MOP" &amp;&amp; document.getElementById("toCurrency").value != "HKD" &amp;&amp; document.getElementById("toCurrency").value != "USD" &amp;&amp; document.getElementById("toCurrency").value != "EUR"</reject>
			<!-- add by lzg end -->
		</field>
		<field name="transferAmount" label="To_Amount">
			<format type="amount" />
			<reject prompt="Amount_Justify">([transferAmount]=="" &amp;&amp; [debitAmount]=="") || ([transferAmount]== 0 &amp;&amp; [debitAmount]== 0)</reject>
			<reject prompt="Amount_Justify_1">[transferAmount]&lt;10 &amp;&amp; [debitAmount]&lt;10 </reject>
		</field>
		<field name="beneficiaryName1" label="Beneficiary_Name">
			<format type="common" />
		</field>
		<field name="beneficiaryName2" label="Beneficiary_Name">
			<format type="common" />
			<reject prompt="Please enter the Beneficiary Account Name">([beneficiaryName1]=="" &amp;&amp; [beneficiaryName2]=="")</reject>
		</field>
		<field name="beneJustify" label="Beneficiary_Name">
			<format type="string" />
			<reject prompt="Not Allow to input single word in Beneficiary Name">[beneJustify]=='Y'</reject>
		</field>
		<field name="beneficiaryBank" label="Beneficiary_Bank"
			required="yes">
			<format type="string" />
		</field>
		<field name="toAccount" label="Beneficiary Account" required="yes">
			<format type="common" />
			<reject prompt="Account_Justify">
				[fromAccount]==[toAccount]
			</reject>
		</field>
		<field name="chargeBy" label="Commission_charges_by" required="yes">
			<format type="string" />
		</field>
		<field name="messsage" label="Message_Send">
			<format type="common" />
		</field>
		<field name="messsage2" label="Message_Send">
			<format type="common" />
		</field>
		<field name="requestType" label="Transfer_Date"	required="yes">
			<format type="string" />
		</field>
		<field name="debitAmount" label="Transfer_Info1" >
			<format type="amount" />
		</field>
		<field name="chareBy" label="Charges_By" required="yes">
			<format type="string" />
		</field>
		<!--<field name="remark" label="Remark" >
			<format type="common" />
		</field>
		--><!-- add by linrui 20190531 -->
		<field name="endDate" label="Transfer_End_Date" required="yes">
			<format type="date"/>
		</field>
		
		<!-- add by lzg 20190602 -->
		<field name="purposeCode" label="Purpose" required="no">
			<reject prompt="Required">document.getElementById("purposeCode").selectedIndex == 0</reject>
		</field>
		<!-- add by lzg end -->
	</group>
</fieldchecking>
