<?xml version="1.0" encoding="UTF-8"?>
<!DOCTYPE fieldchecking SYSTEM "fieldchecking.dtd">
<fieldchecking>
	<group name="add">
		<field name="msgTitle" label="Message_Title" required="yes">
			<format type="string" />
		</field>
		<field name="fromDate" label="From_Date" required="yes">
			<format type="date" />
			<reject prompt="Date_Justify">(getDateValue([fromDate])>getDateValue([toDate]))</reject>
		</field>
		<field name="toDate" label="To_Date" required="yes">
			<format type="date" />
		</field>
		<field name="msgContent" label="Message_Content"
			required="yes">
			<format type="string" minlen="10" maxlen="200" />
		</field>
	</group>
	<group name="bank_list">
		<field name="messageId" label="Message_ID" required="yes" />
	</group>
	<group name="corp_list">
		<field name="messageId" label="muId" required="yes" />
	</group>
</fieldchecking>
